{
  "$schema": "https://json-schema.org/draft/2020-12/schema",
  "title": "Spec-coverage sidecar (research/sweeps/NN-<slug>/spec-coverage.json)",
  "description": "Structured coverage artifact consumed by engine/publish-coverage.py, which prefers it over the sibling spec-coverage.md when both exist. (Sweeps predating the artifact rename keep the legacy filenames 4-spec-coverage.json / 4-spec-coverage.md; the publisher resolves both.) One sidecar per behaviour; its records array is exactly the set of records the publisher writes to data/coverage.json for that behaviour. The citation/coverageRecord $defs mirror data/schema/coverage.schema.json and must change with it (same-document $refs only: engine/validate_data.py's stdlib fallback cannot follow cross-file refs). This schema lives in data/schema/ -- the repo's schema registry -- but is deliberately NOT in engine/validate_data.py's CHECKS, which pair data/*.json files with their schemas; sidecars validate research/sweeps artifacts and are enforced at publish time by publish-coverage.py instead.",
  "type": "object",
  "required": ["sidecar_version", "behaviour_id", "behaviour_name", "slug", "records", "provenance"],
  "additionalProperties": false,
  "properties": {
    "sidecar_version": {
      "type": "integer",
      "minimum": 1,
      "description": "Format version of this sidecar contract; currently always 1."
    },
    "behaviour_id": { "type": "integer", "minimum": 1 },
    "behaviour_name": { "type": "string", "minLength": 1 },
    "slug": {
      "type": "string",
      "pattern": "^[a-z0-9]+(-[a-z0-9]+)*$",
      "description": "The sweep directory's slug: the directory is research/sweeps/NN-<slug>/. publish-coverage.py rejects a sidecar whose slug or behaviour_id does not match the directory it sits in."
    },
    "records": {
      "type": "array",
      "minItems": 1,
      "items": { "$ref": "#/$defs/coverageRecord" },
      "description": "Exactly the records the publisher writes to data/coverage.json for this behaviour: one per lab, in the coverageRecord shape. Records are published verbatim -- citation key order included -- so a sidecar derived from data/coverage.json round-trips byte-for-byte."
    },
    "provenance": { "$ref": "#/$defs/provenance" }
  },
  "$defs": {
    "provenance": {
      "type": "object",
      "required": ["reconstructed"],
      "additionalProperties": false,
      "properties": {
        "reconstructed": {
          "type": "boolean",
          "description": "true when this file was derived after the fact (e.g. mechanically from data/coverage.json) rather than authored as the sweep's stage-4 artifact. Every sidecar must declare this; a reconstructed one must additionally carry reconstructedFrom and reconstructedDate (enforced by publish-coverage.py, since a single-file schema cannot express the conditional)."
        },
        "reconstructedFrom": {
          "type": "string",
          "minLength": 1,
          "description": "The source the records were reconstructed from, e.g. data/coverage.json @ <commit>."
        },
        "reconstructedDate": {
          "type": "string",
          "pattern": "^\\d{4}-\\d{2}-\\d{2}$"
        },
        "note": {
          "type": "string",
          "minLength": 1,
          "description": "What this file establishes and what it cannot -- mandatory honesty for reconstructions: which fields a genuine stage-4 artifact would carry that this one does not."
        }
      }
    },
    "citation": {
      "type": "object",
      "required": ["locator", "quote", "role"],
      "additionalProperties": false,
      "properties": {
        "locator": {
          "type": "string",
          "minLength": 1,
          "description": "Locator per specs/CITATION.md, resolvable by engine/spec-cite/cite.py."
        },
        "quote": {
          "type": "string",
          "minLength": 1,
          "description": "Verbatim quote: exact output of cite.py resolve for the locator."
        },
        "role": {
          "type": "string",
          "minLength": 1,
          "description": "Why this passage is evidence for the verdict."
        },
        "adjacent": {
          "type": "boolean",
          "description": "Reinforcing rather than directly on-point evidence."
        },
        "example_block": {
          "type": "boolean",
          "description": "Citation is a worked-example block; the quote stores the caption line."
        }
      }
    },
    "coverageRecord": {
      "type": "object",
      "required": [
        "behaviour_id",
        "behaviour_name",
        "lab_id",
        "verdict",
        "depth_0_4",
        "depth_note",
        "citations",
        "verified_against_version",
        "verified_date",
        "citation_format"
      ],
      "additionalProperties": false,
      "description": "Same closed shape as data/schema/coverage.schema.json's coverageRecord: the builders consume these fields verbatim, so an undeclared key is a typo or an unreviewed field, not data.",
      "properties": {
        "behaviour_id": { "type": "integer", "minimum": 1 },
        "behaviour_name": { "type": "string", "minLength": 1 },
        "lab_id": {
          "type": "string",
          "minLength": 1,
          "description": "Must match an id in data/labs.json; publish-coverage.py additionally requires exactly one record per lab it publishes."
        },
        "verdict": {
          "enum": ["covered", "partial", "not-in-spec"],
          "description": "Vocabulary per PLAN.md section 2."
        },
        "depth_0_4": { "type": "integer", "minimum": 0, "maximum": 4 },
        "depth_note": { "type": "string", "minLength": 1 },
        "citations": {
          "type": "array",
          "minItems": 1,
          "items": { "$ref": "#/$defs/citation" },
          "description": "No verdict without at least one citation (data/README.md)."
        },
        "verified_against_version": {
          "type": "string",
          "minLength": 1,
          "description": "Spec version the citations were verified against, e.g. 2026-01-20. publish-coverage.py checks it equals the version pinned by the record's first locator."
        },
        "verified_date": {
          "type": "string",
          "pattern": "^\\d{4}-\\d{2}-\\d{2}$"
        },
        "citation_format": { "type": "string", "minLength": 1 }
      }
    }
  }
}
